{
  "application_id": "APP-000038",
  "application_date": "2026-08-12",
  "underwriting_as_of_date": "2026-08-12",
  "channel": "retail",
  "loan_purpose": "purchase",
  "product_family": "conventional_conforming",
  "occupancy_type": "primary_residence",
  "household_size": 2,
  "borrowers": [
    {
      "borrower_id": "BORR-000046",
      "role": "primary",
      "name": "Freya Guerrero",
      "date_of_birth": "1985-06-06",
      "taxpayer_id_masked": "***-**-0046",
      "email": "freya.guerrero046@example.com",
      "phone": "(919) 555-0146",
      "current_address": {
        "street": "1448 Alderwood Lane",
        "city": "Cary",
        "state": "NC",
        "postal_code": "27513"
      },
      "previous_address": null,
      "years_at_current_address": 5,
      "dependents": 2,
      "citizenship_status": "US Citizen"
    }
  ],
  "employment": [
    {
      "borrower_id": "BORR-000046",
      "employer_name": "Thornhill Insurance Brokers",
      "occupation": "Broker",
      "employment_type": "employed",
      "self_employed": false,
      "declared_start_date": "2022-02-12",
      "is_current": true,
      "pay_frequency": "bi_weekly"
    },
    {
      "borrower_id": "BORR-000046",
      "employer_name": "Kestrel Freight Services",
      "occupation": "Operations Associate",
      "employment_type": "employed",
      "self_employed": false,
      "declared_start_date": "2021-07-12",
      "is_current": false,
      "pay_frequency": "bi_weekly"
    }
  ],
  "declared_income": [
    {
      "income_type": "salaried",
      "declared_monthly_amount": "8383.33"
    }
  ],
  "declared_assets": [
    {
      "asset_type": "checking",
      "institution": "Sablefield Trust",
      "account_masked": "******0147",
      "declared_balance": "31648.05"
    },
    {
      "asset_type": "savings",
      "institution": "Sablefield Trust",
      "account_masked": "******0148",
      "declared_balance": "58774.95"
    },
    {
      "asset_type": "brokerage",
      "institution": "Ravenscourt Securities",
      "account_masked": "******0149",
      "declared_balance": "3798.38"
    },
    {
      "asset_type": "retirement",
      "institution": "Meridian Retirement Trust",
      "account_masked": "******0150",
      "declared_balance": "4051.60"
    }
  ],
  "declared_liabilities": [
    {
      "liability_type": "auto_loan",
      "creditor": "Sablefield Mortgage Servicing",
      "balance": "7146.14",
      "monthly_payment": "171.09"
    },
    {
      "liability_type": "student_loan",
      "creditor": "Harborline Retail Credit",
      "balance": "9599.57",
      "monthly_payment": "130.83"
    },
    {
      "liability_type": "revolving_credit_card",
      "creditor": "Summit Education Lending",
      "balance": "4025.67",
      "monthly_payment": "120.77"
    },
    {
      "liability_type": "installment_personal",
      "creditor": "Harborline Retail Credit",
      "balance": "2608.14",
      "monthly_payment": "80.52"
    }
  ],
  "requested_loan": {
    "base_loan_amount": "320000.00",
    "term_months": 360,
    "interest_rate": "0.0665",
    "rate_type": "fixed"
  },
  "subject_property": {
    "street": "2259 Sablecrest Drive",
    "city": "Cary",
    "state": "NC",
    "postal_code": "27513",
    "property_type": "single_family_detached",
    "units": 1,
    "occupancy_intent": "primary_residence",
    "purchase_price": "400000.00"
  },
  "supplied_documents": [
    {
      "document_id": "APP-000038-DOC-01",
      "document_type": "loan_application_summary",
      "document_date": "2026-08-12",
      "trust_class": "customer_evidence",
      "relative_path": "synthetic_data/applicant_documents/APP-000038/01_loan_application_summary.txt"
    },
    {
      "document_id": "APP-000038-DOC-02",
      "document_type": "identity_verification_summary",
      "document_date": "2026-08-04",
      "trust_class": "authoritative_evidence",
      "relative_path": "synthetic_data/applicant_documents/APP-000038/02_identity_verification_summary.txt"
    },
    {
      "document_id": "APP-000038-DOC-03",
      "document_type": "credit_report_summary",
      "document_date": "2026-07-22",
      "trust_class": "authoritative_evidence",
      "relative_path": "synthetic_data/applicant_documents/APP-000038/03_credit_report_summary.txt"
    },
    {
      "document_id": "APP-000038-DOC-04",
      "document_type": "paystub",
      "document_date": "2026-08-01",
      "trust_class": "customer_evidence",
      "relative_path": "synthetic_data/applicant_documents/APP-000038/10_paystub_BORR-000046.txt"
    },
    {
      "document_id": "APP-000038-DOC-05",
      "document_type": "w2",
      "document_date": "2025-12-31",
      "trust_class": "customer_evidence",
      "relative_path": "synthetic_data/applicant_documents/APP-000038/11_w2_BORR-000046.txt"
    },
    {
      "document_id": "APP-000038-DOC-06",
      "document_type": "employment_verification",
      "document_date": "2026-08-04",
      "trust_class": "authoritative_evidence",
      "relative_path": "synthetic_data/applicant_documents/APP-000038/12_employment_verification_BORR-000046.txt"
    },
    {
      "document_id": "APP-000038-DOC-07",
      "document_type": "bank_statement",
      "document_date": "2026-08-03",
      "trust_class": "customer_evidence",
      "relative_path": "synthetic_data/applicant_documents/APP-000038/20_bank_statement_01.txt"
    },
    {
      "document_id": "APP-000038-DOC-08",
      "document_type": "bank_statement",
      "document_date": "2026-08-03",
      "trust_class": "customer_evidence",
      "relative_path": "synthetic_data/applicant_documents/APP-000038/20_bank_statement_02.txt"
    },
    {
      "document_id": "APP-000038-DOC-09",
      "document_type": "asset_verification",
      "document_date": "2026-08-05",
      "trust_class": "authoritative_evidence",
      "relative_path": "synthetic_data/applicant_documents/APP-000038/21_asset_verification_03.txt"
    },
    {
      "document_id": "APP-000038-DOC-10",
      "document_type": "asset_verification",
      "document_date": "2026-08-05",
      "trust_class": "authoritative_evidence",
      "relative_path": "synthetic_data/applicant_documents/APP-000038/21_asset_verification_04.txt"
    },
    {
      "document_id": "APP-000038-DOC-11",
      "document_type": "purchase_agreement",
      "document_date": "2026-07-17",
      "trust_class": "customer_evidence",
      "relative_path": "synthetic_data/applicant_documents/APP-000038/30_purchase_agreement.txt"
    },
    {
      "document_id": "APP-000038-DOC-12",
      "document_type": "appraisal_report",
      "document_date": "2026-07-19",
      "trust_class": "authoritative_evidence",
      "relative_path": "synthetic_data/applicant_documents/APP-000038/40_appraisal_report.txt"
    },
    {
      "document_id": "APP-000038-DOC-13",
      "document_type": "title_report",
      "document_date": "2026-08-06",
      "trust_class": "authoritative_evidence",
      "relative_path": "synthetic_data/applicant_documents/APP-000038/41_title_report.txt"
    },
    {
      "document_id": "APP-000038-DOC-14",
      "document_type": "homeowner_insurance_evidence",
      "document_date": "2026-08-09",
      "trust_class": "authoritative_evidence",
      "relative_path": "synthetic_data/applicant_documents/APP-000038/42_homeowner_insurance_evidence.txt"
    }
  ],
  "untrusted_applicant_text": null
}
