{
  "application_id": "APP-000032",
  "application_date": "2026-08-12",
  "underwriting_as_of_date": "2026-08-12",
  "channel": "retail",
  "loan_purpose": "purchase",
  "product_family": "conventional_conforming",
  "occupancy_type": "primary_residence",
  "household_size": 2,
  "borrowers": [
    {
      "borrower_id": "BORR-000039",
      "role": "primary",
      "name": "Theo Osei",
      "date_of_birth": "1998-04-03",
      "taxpayer_id_masked": "***-**-0039",
      "email": "theo.osei039@example.com",
      "phone": "(913) 555-0139",
      "current_address": {
        "street": "3954 Orchardstone Way",
        "city": "Overland Park",
        "state": "KS",
        "postal_code": "66210"
      },
      "previous_address": null,
      "years_at_current_address": 5,
      "dependents": 1,
      "citizenship_status": "US Citizen"
    }
  ],
  "employment": [
    {
      "borrower_id": "BORR-000039",
      "employer_name": "Orchard Point Hospitality",
      "occupation": "Events Director",
      "employment_type": "employed",
      "self_employed": false,
      "declared_start_date": "2022-02-12",
      "is_current": true,
      "pay_frequency": "bi_weekly"
    },
    {
      "borrower_id": "BORR-000039",
      "employer_name": "Kestrel Freight Services",
      "occupation": "Operations Associate",
      "employment_type": "employed",
      "self_employed": false,
      "declared_start_date": "2021-07-12",
      "is_current": false,
      "pay_frequency": "bi_weekly"
    }
  ],
  "declared_income": [
    {
      "income_type": "salaried",
      "declared_monthly_amount": "10700.00"
    }
  ],
  "declared_assets": [
    {
      "asset_type": "checking",
      "institution": "Northwind Community Bank",
      "account_masked": "******0123",
      "declared_balance": "33682.37"
    },
    {
      "asset_type": "savings",
      "institution": "Northwind Community Bank",
      "account_masked": "******0124",
      "declared_balance": "62552.96"
    },
    {
      "asset_type": "brokerage",
      "institution": "Tidewater Investment Services",
      "account_masked": "******0125",
      "declared_balance": "3878.90"
    },
    {
      "asset_type": "retirement",
      "institution": "Meridian Retirement Trust",
      "account_masked": "******0126",
      "declared_balance": "4137.50"
    }
  ],
  "declared_liabilities": [
    {
      "liability_type": "auto_loan",
      "creditor": "Sablefield Mortgage Servicing",
      "balance": "12154.57",
      "monthly_payment": "291.00"
    },
    {
      "liability_type": "student_loan",
      "creditor": "Cascade Personal Loans",
      "balance": "16327.99",
      "monthly_payment": "222.53"
    },
    {
      "liability_type": "revolving_credit_card",
      "creditor": "Pinnacle Auto Finance",
      "balance": "6847.00",
      "monthly_payment": "205.41"
    },
    {
      "liability_type": "installment_personal",
      "creditor": "Pinnacle Auto Finance",
      "balance": "4435.66",
      "monthly_payment": "136.94"
    }
  ],
  "requested_loan": {
    "base_loan_amount": "376000.00",
    "term_months": 360,
    "interest_rate": "0.0665",
    "rate_type": "fixed"
  },
  "subject_property": {
    "street": "2611 Hazeldene Court",
    "city": "Overland Park",
    "state": "KS",
    "postal_code": "66210",
    "property_type": "single_family_detached",
    "units": 1,
    "occupancy_intent": "primary_residence",
    "purchase_price": "470000.00"
  },
  "supplied_documents": [
    {
      "document_id": "APP-000032-DOC-01",
      "document_type": "loan_application_summary",
      "document_date": "2026-08-12",
      "trust_class": "customer_evidence",
      "relative_path": "synthetic_data/mortgage/applicant_documents/APP-000032/01_loan_application_summary.txt"
    },
    {
      "document_id": "APP-000032-DOC-02",
      "document_type": "identity_verification_summary",
      "document_date": "2026-08-04",
      "trust_class": "authoritative_evidence",
      "relative_path": "synthetic_data/mortgage/applicant_documents/APP-000032/02_identity_verification_summary.txt"
    },
    {
      "document_id": "APP-000032-DOC-03",
      "document_type": "credit_report_summary",
      "document_date": "2026-07-22",
      "trust_class": "authoritative_evidence",
      "relative_path": "synthetic_data/mortgage/applicant_documents/APP-000032/03_credit_report_summary.txt"
    },
    {
      "document_id": "APP-000032-DOC-04",
      "document_type": "paystub",
      "document_date": "2026-08-01",
      "trust_class": "customer_evidence",
      "relative_path": "synthetic_data/mortgage/applicant_documents/APP-000032/10_paystub_BORR-000039.txt"
    },
    {
      "document_id": "APP-000032-DOC-05",
      "document_type": "w2",
      "document_date": "2025-12-31",
      "trust_class": "customer_evidence",
      "relative_path": "synthetic_data/mortgage/applicant_documents/APP-000032/11_w2_BORR-000039.txt"
    },
    {
      "document_id": "APP-000032-DOC-06",
      "document_type": "employment_verification",
      "document_date": "2026-08-04",
      "trust_class": "authoritative_evidence",
      "relative_path": "synthetic_data/mortgage/applicant_documents/APP-000032/12_employment_verification_BORR-000039.txt"
    },
    {
      "document_id": "APP-000032-DOC-07",
      "document_type": "bank_statement",
      "document_date": "2026-08-03",
      "trust_class": "customer_evidence",
      "relative_path": "synthetic_data/mortgage/applicant_documents/APP-000032/20_bank_statement_01.txt"
    },
    {
      "document_id": "APP-000032-DOC-08",
      "document_type": "bank_statement",
      "document_date": "2026-08-03",
      "trust_class": "customer_evidence",
      "relative_path": "synthetic_data/mortgage/applicant_documents/APP-000032/20_bank_statement_02.txt"
    },
    {
      "document_id": "APP-000032-DOC-09",
      "document_type": "asset_verification",
      "document_date": "2026-08-05",
      "trust_class": "authoritative_evidence",
      "relative_path": "synthetic_data/mortgage/applicant_documents/APP-000032/21_asset_verification_03.txt"
    },
    {
      "document_id": "APP-000032-DOC-10",
      "document_type": "asset_verification",
      "document_date": "2026-08-05",
      "trust_class": "authoritative_evidence",
      "relative_path": "synthetic_data/mortgage/applicant_documents/APP-000032/21_asset_verification_04.txt"
    },
    {
      "document_id": "APP-000032-DOC-11",
      "document_type": "purchase_agreement",
      "document_date": "2026-07-17",
      "trust_class": "customer_evidence",
      "relative_path": "synthetic_data/mortgage/applicant_documents/APP-000032/30_purchase_agreement.txt"
    },
    {
      "document_id": "APP-000032-DOC-12",
      "document_type": "appraisal_report",
      "document_date": "2026-07-19",
      "trust_class": "authoritative_evidence",
      "relative_path": "synthetic_data/mortgage/applicant_documents/APP-000032/40_appraisal_report.txt"
    },
    {
      "document_id": "APP-000032-DOC-13",
      "document_type": "title_report",
      "document_date": "2026-08-06",
      "trust_class": "authoritative_evidence",
      "relative_path": "synthetic_data/mortgage/applicant_documents/APP-000032/41_title_report.txt"
    },
    {
      "document_id": "APP-000032-DOC-14",
      "document_type": "homeowner_insurance_evidence",
      "document_date": "2026-08-09",
      "trust_class": "authoritative_evidence",
      "relative_path": "synthetic_data/mortgage/applicant_documents/APP-000032/42_homeowner_insurance_evidence.txt"
    },
    {
      "document_id": "APP-000032-DOC-15",
      "document_type": "letter_of_explanation",
      "document_date": "2026-08-09",
      "trust_class": "customer_evidence",
      "relative_path": "synthetic_data/mortgage/applicant_documents/APP-000032/60_letter_of_explanation.txt"
    }
  ],
  "untrusted_applicant_text": null
}
