{
  "application_id": "APP-000022",
  "application_date": "2026-08-12",
  "underwriting_as_of_date": "2026-08-12",
  "channel": "retail",
  "loan_purpose": "rate_term_refinance",
  "product_family": "conventional_conforming",
  "occupancy_type": "primary_residence",
  "household_size": 2,
  "borrowers": [
    {
      "borrower_id": "BORR-000026",
      "role": "primary",
      "name": "Silas Kirilenko",
      "date_of_birth": "2002-11-28",
      "taxpayer_id_masked": "***-**-0026",
      "email": "silas.kirilenko026@example.com",
      "phone": "(972) 555-0126",
      "current_address": {
        "street": "1697 Juniper Bend",
        "city": "Plano",
        "state": "TX",
        "postal_code": "75024"
      },
      "previous_address": null,
      "years_at_current_address": 11,
      "dependents": 3,
      "citizenship_status": "Permanent Resident"
    },
    {
      "borrower_id": "BORR-000027",
      "role": "co_borrower",
      "name": "Anton Guerrero",
      "date_of_birth": "1967-12-16",
      "taxpayer_id_masked": "***-**-0027",
      "email": "anton.guerrero027@example.com",
      "phone": "(630) 555-0127",
      "current_address": {
        "street": "2072 Orchardstone Way",
        "city": "Naperville",
        "state": "IL",
        "postal_code": "60540"
      },
      "previous_address": null,
      "years_at_current_address": 5,
      "dependents": 0,
      "citizenship_status": "Permanent Resident"
    }
  ],
  "employment": [
    {
      "borrower_id": "BORR-000026",
      "employer_name": "Latchford Construction",
      "occupation": "Site Supervisor",
      "employment_type": "employed",
      "self_employed": false,
      "declared_start_date": "2022-02-12",
      "is_current": true,
      "pay_frequency": "bi_weekly"
    },
    {
      "borrower_id": "BORR-000026",
      "employer_name": "Kestrel Freight Services",
      "occupation": "Operations Associate",
      "employment_type": "employed",
      "self_employed": false,
      "declared_start_date": "2021-07-12",
      "is_current": false,
      "pay_frequency": "bi_weekly"
    },
    {
      "borrower_id": "BORR-000027",
      "employer_name": "Kestrel Freight Services",
      "occupation": "Logistics Planner",
      "employment_type": "employed",
      "self_employed": false,
      "declared_start_date": "2022-09-12",
      "is_current": true,
      "pay_frequency": "bi_weekly"
    },
    {
      "borrower_id": "BORR-000027",
      "employer_name": "Kestrel Freight Services",
      "occupation": "Operations Associate",
      "employment_type": "employed",
      "self_employed": false,
      "declared_start_date": "2021-07-12",
      "is_current": false,
      "pay_frequency": "bi_weekly"
    }
  ],
  "declared_income": [
    {
      "income_type": "salaried",
      "declared_monthly_amount": "6665.17"
    },
    {
      "income_type": "salaried",
      "declared_monthly_amount": "4826.50"
    }
  ],
  "declared_assets": [
    {
      "asset_type": "checking",
      "institution": "Harbor Point Savings",
      "account_masked": "******0081",
      "declared_balance": "7408.37"
    },
    {
      "asset_type": "savings",
      "institution": "Harbor Point Savings",
      "account_masked": "******0082",
      "declared_balance": "13758.39"
    },
    {
      "asset_type": "brokerage",
      "institution": "Tidewater Investment Services",
      "account_masked": "******0083",
      "declared_balance": "6249.14"
    },
    {
      "asset_type": "retirement",
      "institution": "Meridian Retirement Trust",
      "account_masked": "******0084",
      "declared_balance": "6665.73"
    }
  ],
  "declared_liabilities": [
    {
      "liability_type": "auto_loan",
      "creditor": "Sablefield Mortgage Servicing",
      "balance": "9787.56",
      "monthly_payment": "234.33"
    },
    {
      "liability_type": "student_loan",
      "creditor": "Summit Education Lending",
      "balance": "13147.95",
      "monthly_payment": "179.19"
    },
    {
      "liability_type": "revolving_credit_card",
      "creditor": "Summit Education Lending",
      "balance": "5513.67",
      "monthly_payment": "165.41"
    },
    {
      "liability_type": "installment_personal",
      "creditor": "Northwind Card Services",
      "balance": "3572.11",
      "monthly_payment": "110.28"
    }
  ],
  "requested_loan": {
    "base_loan_amount": "381888.00",
    "term_months": 360,
    "interest_rate": "0.0665",
    "rate_type": "fixed"
  },
  "subject_property": {
    "street": "2527 Hazeldene Court",
    "city": "Plano",
    "state": "TX",
    "postal_code": "75024",
    "property_type": "single_family_detached",
    "units": 1,
    "occupancy_intent": "primary_residence",
    "purchase_price": null
  },
  "supplied_documents": [
    {
      "document_id": "APP-000022-DOC-01",
      "document_type": "loan_application_summary",
      "document_date": "2026-08-12",
      "trust_class": "customer_evidence",
      "relative_path": "synthetic_data/mortgage/applicant_documents/APP-000022/01_loan_application_summary.txt"
    },
    {
      "document_id": "APP-000022-DOC-02",
      "document_type": "identity_verification_summary",
      "document_date": "2026-08-04",
      "trust_class": "authoritative_evidence",
      "relative_path": "synthetic_data/mortgage/applicant_documents/APP-000022/02_identity_verification_summary.txt"
    },
    {
      "document_id": "APP-000022-DOC-03",
      "document_type": "credit_report_summary",
      "document_date": "2026-07-22",
      "trust_class": "authoritative_evidence",
      "relative_path": "synthetic_data/mortgage/applicant_documents/APP-000022/03_credit_report_summary.txt"
    },
    {
      "document_id": "APP-000022-DOC-04",
      "document_type": "paystub",
      "document_date": "2026-08-01",
      "trust_class": "customer_evidence",
      "relative_path": "synthetic_data/mortgage/applicant_documents/APP-000022/10_paystub_BORR-000026.txt"
    },
    {
      "document_id": "APP-000022-DOC-05",
      "document_type": "w2",
      "document_date": "2025-12-31",
      "trust_class": "customer_evidence",
      "relative_path": "synthetic_data/mortgage/applicant_documents/APP-000022/11_w2_BORR-000026.txt"
    },
    {
      "document_id": "APP-000022-DOC-06",
      "document_type": "employment_verification",
      "document_date": "2026-08-04",
      "trust_class": "authoritative_evidence",
      "relative_path": "synthetic_data/mortgage/applicant_documents/APP-000022/12_employment_verification_BORR-000026.txt"
    },
    {
      "document_id": "APP-000022-DOC-07",
      "document_type": "paystub",
      "document_date": "2026-08-01",
      "trust_class": "customer_evidence",
      "relative_path": "synthetic_data/mortgage/applicant_documents/APP-000022/10_paystub_BORR-000027.txt"
    },
    {
      "document_id": "APP-000022-DOC-08",
      "document_type": "w2",
      "document_date": "2025-12-31",
      "trust_class": "customer_evidence",
      "relative_path": "synthetic_data/mortgage/applicant_documents/APP-000022/11_w2_BORR-000027.txt"
    },
    {
      "document_id": "APP-000022-DOC-09",
      "document_type": "employment_verification",
      "document_date": "2026-08-04",
      "trust_class": "authoritative_evidence",
      "relative_path": "synthetic_data/mortgage/applicant_documents/APP-000022/12_employment_verification_BORR-000027.txt"
    },
    {
      "document_id": "APP-000022-DOC-10",
      "document_type": "bank_statement",
      "document_date": "2026-08-03",
      "trust_class": "customer_evidence",
      "relative_path": "synthetic_data/mortgage/applicant_documents/APP-000022/20_bank_statement_01.txt"
    },
    {
      "document_id": "APP-000022-DOC-11",
      "document_type": "bank_statement",
      "document_date": "2026-08-03",
      "trust_class": "customer_evidence",
      "relative_path": "synthetic_data/mortgage/applicant_documents/APP-000022/20_bank_statement_02.txt"
    },
    {
      "document_id": "APP-000022-DOC-12",
      "document_type": "asset_verification",
      "document_date": "2026-08-05",
      "trust_class": "authoritative_evidence",
      "relative_path": "synthetic_data/mortgage/applicant_documents/APP-000022/21_asset_verification_03.txt"
    },
    {
      "document_id": "APP-000022-DOC-13",
      "document_type": "asset_verification",
      "document_date": "2026-08-05",
      "trust_class": "authoritative_evidence",
      "relative_path": "synthetic_data/mortgage/applicant_documents/APP-000022/21_asset_verification_04.txt"
    },
    {
      "document_id": "APP-000022-DOC-14",
      "document_type": "payoff_statement",
      "document_date": "2026-08-08",
      "trust_class": "authoritative_evidence",
      "relative_path": "synthetic_data/mortgage/applicant_documents/APP-000022/31_payoff_statement.txt"
    },
    {
      "document_id": "APP-000022-DOC-15",
      "document_type": "appraisal_report",
      "document_date": "2026-07-19",
      "trust_class": "authoritative_evidence",
      "relative_path": "synthetic_data/mortgage/applicant_documents/APP-000022/40_appraisal_report.txt"
    },
    {
      "document_id": "APP-000022-DOC-16",
      "document_type": "title_report",
      "document_date": "2026-08-06",
      "trust_class": "authoritative_evidence",
      "relative_path": "synthetic_data/mortgage/applicant_documents/APP-000022/41_title_report.txt"
    },
    {
      "document_id": "APP-000022-DOC-17",
      "document_type": "homeowner_insurance_evidence",
      "document_date": "2026-08-09",
      "trust_class": "authoritative_evidence",
      "relative_path": "synthetic_data/mortgage/applicant_documents/APP-000022/42_homeowner_insurance_evidence.txt"
    }
  ],
  "untrusted_applicant_text": null
}
