{
  "application_id": "APP-000060",
  "application_date": "2026-08-12",
  "underwriting_as_of_date": "2026-08-12",
  "channel": "retail",
  "loan_purpose": "purchase",
  "product_family": "conventional_conforming",
  "occupancy_type": "primary_residence",
  "household_size": 2,
  "borrowers": [
    {
      "borrower_id": "BORR-000072",
      "role": "primary",
      "name": "Talia Ravenscroft",
      "date_of_birth": "1961-03-03",
      "taxpayer_id_masked": "***-**-0072",
      "email": "talia.ravenscroft072@example.com",
      "phone": "(630) 555-0172",
      "current_address": {
        "street": "3744 Quarrystone Lane",
        "city": "Naperville",
        "state": "IL",
        "postal_code": "60540"
      },
      "previous_address": null,
      "years_at_current_address": 3,
      "dependents": 2,
      "citizenship_status": "US Citizen"
    }
  ],
  "employment": [
    {
      "borrower_id": "BORR-000072",
      "employer_name": "Grayson Municipal Authority",
      "occupation": "Records Administrator",
      "employment_type": "employed",
      "self_employed": false,
      "declared_start_date": "2022-02-12",
      "is_current": true,
      "pay_frequency": "bi_weekly"
    },
    {
      "borrower_id": "BORR-000072",
      "employer_name": "Kestrel Freight Services",
      "occupation": "Operations Associate",
      "employment_type": "employed",
      "self_employed": false,
      "declared_start_date": "2021-07-12",
      "is_current": false,
      "pay_frequency": "bi_weekly"
    }
  ],
  "declared_income": [
    {
      "income_type": "salaried",
      "declared_monthly_amount": "14916.67"
    }
  ],
  "declared_assets": [
    {
      "asset_type": "checking",
      "institution": "Cascade Mutual Credit Union",
      "account_masked": "******0233",
      "declared_balance": "10792.25"
    },
    {
      "asset_type": "savings",
      "institution": "Cascade Mutual Credit Union",
      "account_masked": "******0234",
      "declared_balance": "20042.74"
    },
    {
      "asset_type": "brokerage",
      "institution": "Ravenscourt Securities",
      "account_masked": "******0235",
      "declared_balance": "5407.14"
    },
    {
      "asset_type": "retirement",
      "institution": "Meridian Retirement Trust",
      "account_masked": "******0236",
      "declared_balance": "5767.62"
    }
  ],
  "declared_liabilities": [
    {
      "liability_type": "auto_loan",
      "creditor": "Cascade Personal Loans",
      "balance": "14830.25",
      "monthly_payment": "355.06"
    },
    {
      "liability_type": "student_loan",
      "creditor": "Northwind Card Services",
      "balance": "19922.60",
      "monthly_payment": "271.52"
    },
    {
      "liability_type": "revolving_credit_card",
      "creditor": "Harborline Retail Credit",
      "balance": "8354.33",
      "monthly_payment": "250.63"
    },
    {
      "liability_type": "installment_personal",
      "creditor": "Northwind Card Services",
      "balance": "5411.93",
      "monthly_payment": "167.08"
    }
  ],
  "requested_loan": {
    "base_loan_amount": "465600.00",
    "term_months": 360,
    "interest_rate": "0.0665",
    "rate_type": "fixed"
  },
  "subject_property": {
    "street": "2224 Wrenfield Way",
    "city": "Naperville",
    "state": "IL",
    "postal_code": "60540",
    "property_type": "single_family_detached",
    "units": 1,
    "occupancy_intent": "primary_residence",
    "purchase_price": "480000.00"
  },
  "supplied_documents": [
    {
      "document_id": "APP-000060-DOC-01",
      "document_type": "loan_application_summary",
      "document_date": "2026-08-12",
      "trust_class": "customer_evidence",
      "relative_path": "synthetic_data/mortgage/applicant_documents/APP-000060/01_loan_application_summary.txt"
    },
    {
      "document_id": "APP-000060-DOC-02",
      "document_type": "identity_verification_summary",
      "document_date": "2026-08-04",
      "trust_class": "authoritative_evidence",
      "relative_path": "synthetic_data/mortgage/applicant_documents/APP-000060/02_identity_verification_summary.txt"
    },
    {
      "document_id": "APP-000060-DOC-03",
      "document_type": "credit_report_summary",
      "document_date": "2026-07-22",
      "trust_class": "authoritative_evidence",
      "relative_path": "synthetic_data/mortgage/applicant_documents/APP-000060/03_credit_report_summary.txt"
    },
    {
      "document_id": "APP-000060-DOC-04",
      "document_type": "paystub",
      "document_date": "2026-08-01",
      "trust_class": "customer_evidence",
      "relative_path": "synthetic_data/mortgage/applicant_documents/APP-000060/10_paystub_BORR-000072.txt"
    },
    {
      "document_id": "APP-000060-DOC-05",
      "document_type": "w2",
      "document_date": "2025-12-31",
      "trust_class": "customer_evidence",
      "relative_path": "synthetic_data/mortgage/applicant_documents/APP-000060/11_w2_BORR-000072.txt"
    },
    {
      "document_id": "APP-000060-DOC-06",
      "document_type": "employment_verification",
      "document_date": "2026-08-04",
      "trust_class": "authoritative_evidence",
      "relative_path": "synthetic_data/mortgage/applicant_documents/APP-000060/12_employment_verification_BORR-000072.txt"
    },
    {
      "document_id": "APP-000060-DOC-07",
      "document_type": "bank_statement",
      "document_date": "2026-08-03",
      "trust_class": "customer_evidence",
      "relative_path": "synthetic_data/mortgage/applicant_documents/APP-000060/20_bank_statement_01.txt"
    },
    {
      "document_id": "APP-000060-DOC-08",
      "document_type": "bank_statement",
      "document_date": "2026-08-03",
      "trust_class": "customer_evidence",
      "relative_path": "synthetic_data/mortgage/applicant_documents/APP-000060/20_bank_statement_02.txt"
    },
    {
      "document_id": "APP-000060-DOC-09",
      "document_type": "asset_verification",
      "document_date": "2026-08-05",
      "trust_class": "authoritative_evidence",
      "relative_path": "synthetic_data/mortgage/applicant_documents/APP-000060/21_asset_verification_03.txt"
    },
    {
      "document_id": "APP-000060-DOC-10",
      "document_type": "asset_verification",
      "document_date": "2026-08-05",
      "trust_class": "authoritative_evidence",
      "relative_path": "synthetic_data/mortgage/applicant_documents/APP-000060/21_asset_verification_04.txt"
    },
    {
      "document_id": "APP-000060-DOC-11",
      "document_type": "purchase_agreement",
      "document_date": "2026-07-17",
      "trust_class": "customer_evidence",
      "relative_path": "synthetic_data/mortgage/applicant_documents/APP-000060/30_purchase_agreement.txt"
    },
    {
      "document_id": "APP-000060-DOC-12",
      "document_type": "appraisal_report",
      "document_date": "2026-07-19",
      "trust_class": "authoritative_evidence",
      "relative_path": "synthetic_data/mortgage/applicant_documents/APP-000060/40_appraisal_report.txt"
    },
    {
      "document_id": "APP-000060-DOC-13",
      "document_type": "title_report",
      "document_date": "2026-08-06",
      "trust_class": "authoritative_evidence",
      "relative_path": "synthetic_data/mortgage/applicant_documents/APP-000060/41_title_report.txt"
    },
    {
      "document_id": "APP-000060-DOC-14",
      "document_type": "homeowner_insurance_evidence",
      "document_date": "2026-08-09",
      "trust_class": "authoritative_evidence",
      "relative_path": "synthetic_data/mortgage/applicant_documents/APP-000060/42_homeowner_insurance_evidence.txt"
    }
  ],
  "untrusted_applicant_text": null
}
