{
  "application_id": "APP-000059",
  "application_date": "2026-09-04",
  "underwriting_as_of_date": "2026-09-04",
  "channel": "retail",
  "loan_purpose": "purchase",
  "product_family": "conventional_conforming",
  "occupancy_type": "primary_residence",
  "household_size": 2,
  "borrowers": [
    {
      "borrower_id": "BORR-000071",
      "role": "primary",
      "name": "Talia Thornbury",
      "date_of_birth": "1976-07-05",
      "taxpayer_id_masked": "***-**-0071",
      "email": "talia.thornbury071@example.com",
      "phone": "(913) 555-0171",
      "current_address": {
        "street": "9659 Juniper Bend",
        "city": "Overland Park",
        "state": "KS",
        "postal_code": "66210"
      },
      "previous_address": null,
      "years_at_current_address": 10,
      "dependents": 3,
      "citizenship_status": "Permanent Resident"
    }
  ],
  "employment": [
    {
      "borrower_id": "BORR-000071",
      "employer_name": "Meridian Civic Health",
      "occupation": "Practice Manager",
      "employment_type": "employed",
      "self_employed": false,
      "declared_start_date": "2022-03-04",
      "is_current": true,
      "pay_frequency": "bi_weekly"
    },
    {
      "borrower_id": "BORR-000071",
      "employer_name": "Kestrel Freight Services",
      "occupation": "Operations Associate",
      "employment_type": "employed",
      "self_employed": false,
      "declared_start_date": "2021-08-04",
      "is_current": false,
      "pay_frequency": "bi_weekly"
    }
  ],
  "declared_income": [
    {
      "income_type": "salaried",
      "declared_monthly_amount": "12416.67"
    }
  ],
  "declared_assets": [
    {
      "asset_type": "checking",
      "institution": "Harbor Point Savings",
      "account_masked": "******0229",
      "declared_balance": "13134.17"
    },
    {
      "asset_type": "savings",
      "institution": "Harbor Point Savings",
      "account_masked": "******0230",
      "declared_balance": "24392.04"
    },
    {
      "asset_type": "brokerage",
      "institution": "Ravenscourt Securities",
      "account_masked": "******0231",
      "declared_balance": "5625.69"
    },
    {
      "asset_type": "retirement",
      "institution": "Meridian Retirement Trust",
      "account_masked": "******0232",
      "declared_balance": "6000.73"
    }
  ],
  "declared_liabilities": [
    {
      "liability_type": "auto_loan",
      "creditor": "Harborline Retail Credit",
      "balance": "15875.29",
      "monthly_payment": "380.08"
    },
    {
      "liability_type": "student_loan",
      "creditor": "Northwind Card Services",
      "balance": "21326.25",
      "monthly_payment": "290.65"
    },
    {
      "liability_type": "revolving_credit_card",
      "creditor": "Sablefield Mortgage Servicing",
      "balance": "8943.00",
      "monthly_payment": "268.29"
    },
    {
      "liability_type": "installment_personal",
      "creditor": "Summit Education Lending",
      "balance": "5793.82",
      "monthly_payment": "178.87"
    }
  ],
  "requested_loan": {
    "base_loan_amount": "418000.00",
    "term_months": 360,
    "interest_rate": "0.0665",
    "rate_type": "fixed"
  },
  "subject_property": {
    "street": "2723 Hazeldene Court",
    "city": "Overland Park",
    "state": "KS",
    "postal_code": "66210",
    "property_type": "single_family_detached",
    "units": 1,
    "occupancy_intent": "primary_residence",
    "purchase_price": "440000.00"
  },
  "supplied_documents": [
    {
      "document_id": "APP-000059-DOC-01",
      "document_type": "loan_application_summary",
      "document_date": "2026-09-04",
      "trust_class": "customer_evidence",
      "relative_path": "synthetic_data/mortgage/applicant_documents/APP-000059/01_loan_application_summary.txt"
    },
    {
      "document_id": "APP-000059-DOC-02",
      "document_type": "identity_verification_summary",
      "document_date": "2026-08-27",
      "trust_class": "authoritative_evidence",
      "relative_path": "synthetic_data/mortgage/applicant_documents/APP-000059/02_identity_verification_summary.txt"
    },
    {
      "document_id": "APP-000059-DOC-03",
      "document_type": "credit_report_summary",
      "document_date": "2026-08-14",
      "trust_class": "authoritative_evidence",
      "relative_path": "synthetic_data/mortgage/applicant_documents/APP-000059/03_credit_report_summary.txt"
    },
    {
      "document_id": "APP-000059-DOC-04",
      "document_type": "paystub",
      "document_date": "2026-08-24",
      "trust_class": "customer_evidence",
      "relative_path": "synthetic_data/mortgage/applicant_documents/APP-000059/10_paystub_BORR-000071.txt"
    },
    {
      "document_id": "APP-000059-DOC-05",
      "document_type": "w2",
      "document_date": "2025-12-31",
      "trust_class": "customer_evidence",
      "relative_path": "synthetic_data/mortgage/applicant_documents/APP-000059/11_w2_BORR-000071.txt"
    },
    {
      "document_id": "APP-000059-DOC-06",
      "document_type": "employment_verification",
      "document_date": "2026-08-27",
      "trust_class": "authoritative_evidence",
      "relative_path": "synthetic_data/mortgage/applicant_documents/APP-000059/12_employment_verification_BORR-000071.txt"
    },
    {
      "document_id": "APP-000059-DOC-07",
      "document_type": "bank_statement",
      "document_date": "2026-08-26",
      "trust_class": "customer_evidence",
      "relative_path": "synthetic_data/mortgage/applicant_documents/APP-000059/20_bank_statement_01.txt"
    },
    {
      "document_id": "APP-000059-DOC-08",
      "document_type": "bank_statement",
      "document_date": "2026-08-26",
      "trust_class": "customer_evidence",
      "relative_path": "synthetic_data/mortgage/applicant_documents/APP-000059/20_bank_statement_02.txt"
    },
    {
      "document_id": "APP-000059-DOC-09",
      "document_type": "asset_verification",
      "document_date": "2026-08-28",
      "trust_class": "authoritative_evidence",
      "relative_path": "synthetic_data/mortgage/applicant_documents/APP-000059/21_asset_verification_03.txt"
    },
    {
      "document_id": "APP-000059-DOC-10",
      "document_type": "asset_verification",
      "document_date": "2026-08-28",
      "trust_class": "authoritative_evidence",
      "relative_path": "synthetic_data/mortgage/applicant_documents/APP-000059/21_asset_verification_04.txt"
    },
    {
      "document_id": "APP-000059-DOC-11",
      "document_type": "purchase_agreement",
      "document_date": "2026-08-09",
      "trust_class": "customer_evidence",
      "relative_path": "synthetic_data/mortgage/applicant_documents/APP-000059/30_purchase_agreement.txt"
    },
    {
      "document_id": "APP-000059-DOC-12",
      "document_type": "appraisal_report",
      "document_date": "2026-08-11",
      "trust_class": "authoritative_evidence",
      "relative_path": "synthetic_data/mortgage/applicant_documents/APP-000059/40_appraisal_report.txt"
    },
    {
      "document_id": "APP-000059-DOC-13",
      "document_type": "title_report",
      "document_date": "2026-08-29",
      "trust_class": "authoritative_evidence",
      "relative_path": "synthetic_data/mortgage/applicant_documents/APP-000059/41_title_report.txt"
    },
    {
      "document_id": "APP-000059-DOC-14",
      "document_type": "homeowner_insurance_evidence",
      "document_date": "2026-09-01",
      "trust_class": "authoritative_evidence",
      "relative_path": "synthetic_data/mortgage/applicant_documents/APP-000059/42_homeowner_insurance_evidence.txt"
    }
  ],
  "untrusted_applicant_text": null
}
